date,channel,format,asset,caption_angle,cta,hashtags
2026-02-05,LinkedIn,Carousel,"PROG_1, PROG_2, PROG_4","Portfolio update + 3 case snapshot","Commenta con il progetto che ti ha colpito","#portfolio #graphicdesign #advertising #branding"
2026-02-07,Instagram,Carousel,"PROG_5, PROG_8, PROG_10","Print + campaign visual","Salva il post per ispirazione","#designitalia #artdirection #visualdesign #creativity"
2026-02-10,TikTok,Short video,"PROG_1..PROG_13 montage","Before/after e process rapido","Scrivi PROCESS per il breakdown completo","#designprocess #portfolio #creativita #fyp"
2026-02-12,YouTube,Short,"PROG_2 + PROG_10","30s showreel case-based","Guarda il portfolio completo dal link in descrizione","#showreel #motiondesign #creativeportfolio"
2026-02-14,LinkedIn,Single image,"PROG_13","UI/layout focus","DM aperti per collaborazioni","#ui #ux #layout #digitaldesign"
2026-02-17,Instagram,Reel,"BIO_1 + PROG highlights","Chi sono + cosa faccio","Seguimi per nuovi case","#freelancecreative #contentcreator #branddesign"
